id,id_telp,email,tanggal,jenis_pesanan,datetime_tugas,lokasi_jemput,lat_jemput,long_jemput,lokasi_tujuan,lat_tujuan,long_tujuan,datetime_selesai,jarak,pendapatan_bersih,poin_tambahan,jenis_pembayaran,jarak_jemput_tujuan,perbedaan_jarak,time,day_of_week,hour,date_dummy
27914,,godcu.scm2828@gmail.com,2023-05-14 00:00:00,Ride,2023-05-14 02:25:00,"Jl. Cihaur No.22, Dago, Bandung City, West Java",-6.8790227,107.6191507,"Jl. Sukakarya, Sukagalih, Bandung City, West Java",-6.887864,107.5824216,2023-05-14 06:53:00,2.64,18000,150.0,Dompet,7.569,4.929,02:25:00,6,2,2023-05-07 02:25:00
14055,83822837822.0,ayu993572@gmail.com,2023-05-13 00:00:00,Food,2023-05-13 02:46:00,"Jl hasanudin no 36, dago",-6.8828963,107.6168936,"3JM5+7J8, jl braga, braga",-6.9168322,107.6065032,2023-05-13 03:04:00,3.55,11200,150.0,Dompet,5.284,1.734,02:46:00,5,2,2023-05-07 02:46:00
10524,82217467980.0,ridwanabex@gmail.com,2023-05-13 00:00:00,Food,2023-05-13 02:55:00,"Jl. Buah Batu No.180, Cijagra, Kec. Lengkong, Kota Bandung, Jawa Barat 40265",-6.9390905,107.6244095,"Jalan H. Umayah II, Citeureup, Kab. Bandung",-6.9770925,107.6331663,2023-05-13 03:16:00,5.02,15600,150.0,Dompet + Tunai,6.737,1.717,02:55:00,5,2,2023-05-07 02:55:00
2200,82115300676.0,nurrochimcirebon@gmail.com,2023-05-13 00:00:00,Food,2023-05-13 02:34:00,"Jl. Cibiuk, Cangkuang Wetan, Bandung, Jawa Barat",-6.9646121,107.60502,"Bandung, Pasirluyu, Kec. Regol, Kota Bandung, Jawa Barat 40254",-6.9490875,107.6182031,2023-05-13 03:07:00,3.5,12400,150.0,Tunai,4.891,1.391,02:34:00,5,2,2023-05-07 02:34:00
171,82120934250.0,brigezwawan72@gmail.com,5/14/2023,Food,2023-05-14 02:58:00,"Jl. Kalijati 6 No.52, Antapani Kulon, Kec. Antapani, Kota Bandung, Jawa Barat 40291",-6.9103903,107.6539258,"Jl. Garu V Jl. Pasangan 1 No.3, Babakan Sari, Kec. Kiaracondong, Kota Bandung, Jawa Barat 40283",-6.9205676,107.6510063,2023-05-14 03:22:00,2.02,11200,150.0,Dompet + Tunai,2.475,0.4550000000000001,02:58:00,6,2,2023-05-07 02:58:00
7874,81214895219.0,ajaytampan17@gmail.com,5/7/2023,Food,2023-05-07 02:54:00,"Gg. Sukabakti II No.190, Sukabungah, Kec. Sukajadi, Kota Bandung, Jawa Barat 40162",-6.8933272,107.5838787,"Jl. Industri No.15, Arjuna, Kec. Cicendo, Kota Bandung, Jawa Barat 40172",-6.9134097,107.5831085,2023-05-07 03:12:00,3.52,11200,150.0,Dompet,3.84,0.3199999999999998,02:54:00,6,2,2023-05-07 02:54:00
17410,81214830229.0,adamhidayat372@gmail.com,5/14/2023,Food,2023-05-14 02:31:00,"jl tubagus ismail raya no 5c, dago, bandung",-6.8840421,107.6150353,"jl rereng wulung no 36, sukaluyu",-6.8960487,107.6319001,2023-05-14 02:44:00,2.8,11200,150.0,Dompet,2.814,0.01400000000000023,02:31:00,6,2,2023-05-07 02:31:00
172,82120934250.0,brigezwawan72@gmail.com,5/14/2023,Kurir Barang,2023-05-14 02:39:00,"Gg. II No.35, Pasirlayung, Kec. Cibeunying Kidul, Kota Bandung, Jawa Barat 40192",-6.8991652,107.6550207,"Jl. Pelajar Pejuang 45 No.25, Lkr. Sel., Kec. Lengkong, Kota Bandung, Jawa Barat 40263",-6.9269996,107.6273362,2023-05-14 02:49:00,5.18,10400,150.0,Tunai,5.176,0.003999999999999559,02:39:00,6,2,2023-05-07 02:39:00
